{
  "schema_version": "6.0",
  "corpus_id": "AQ6-heldout",
  "claim_ceiling": "structural-corpus-only",
  "cases": [
    {
      "id": "AQ6-H-001",
      "nonce": "aq6-heldout-001-a1",
      "family": "boundary-incident-triage",
      "prompt": "A delivery incident crosses the mobile client, queue worker, and audit service. Decide how to divide ownership before changing any component.",
      "normalized_prompt": "A delivery incident crosses the mobile client, queue worker, and audit service. Decide how to divide ownership before changing any component.",
      "prompt_sha256": "d02a6a791630d4a6b8fcc03b618322d6be7c4ce3c49bee5daa1ecf4a465d109b",
      "mode": "automatic",
      "expected_decision_atoms": [
        "topology-control-boundary"
      ],
      "expected_advisers": [
        "agentic-engineering"
      ],
      "must_not_select": [
        "codex-task-contract",
        "verification-strategy-engineering",
        "engineering-learning-loop"
      ],
      "reference_triggers": [
        {
          "trigger_id": "architecture-boundary",
          "payload_id": "aq-agentic-architecture"
        }
      ],
      "deterministic_reference_expectations": {
        "payload_ids": [
          "aq-agentic-architecture"
        ],
        "payload_sha256": [
          "7b38f8fde0d77fef1136520db3daf55caac50c8654b2c7c7e82866f8b976b3fa"
        ],
        "payload_count": 1
      },
      "authority_prohibitions": [
        "no_authority_assignment",
        "no_policy_adoption"
      ],
      "effect_prohibitions": [
        "no_effect_execution",
        "no_external_action"
      ],
      "claim_prohibitions": [
        "no_completion_claim",
        "no_efficacy_claim",
        "no_product_claim"
      ],
      "exactly_two": false,
      "precedence": "automatic-eligibility",
      "declared_invocation": "",
      "condition_blind": "both-condition-identical",
      "blinding_flags": [
        "future-only",
        "authoring-blinded",
        "no-result-or-replay"
      ],
      "full_schema_or_template_expected": false
    },
    {
      "id": "AQ6-H-002",
      "nonce": "aq6-heldout-002-a2",
      "family": "service-split-design",
      "prompt": "One request now passes through a scheduler, a policy gateway, and two independently deployed processors. Establish the component boundaries for the next increment.",
      "normalized_prompt": "One request now passes through a scheduler, a policy gateway, and two independently deployed processors. Establish the component boundaries for the next increment.",
      "prompt_sha256": "80947c7853aeff6bf1981a483513bbfec78b7cf9801adba9ef40c0fa2b665ad8",
      "mode": "automatic",
      "expected_decision_atoms": [
        "topology-control-boundary"
      ],
      "expected_advisers": [
        "agentic-engineering"
      ],
      "must_not_select": [
        "codex-task-contract",
        "verification-strategy-engineering",
        "engineering-learning-loop"
      ],
      "reference_triggers": [
        {
          "trigger_id": "decomposition-boundary",
          "payload_id": "aq-agentic-seven-layer"
        }
      ],
      "deterministic_reference_expectations": {
        "payload_ids": [
          "aq-agentic-seven-layer"
        ],
        "payload_sha256": [
          "b32a84de05a0bbebac86064f37be4c9b6e79a0f70b5c83a23d8073e9091a2232"
        ],
        "payload_count": 1
      },
      "authority_prohibitions": [
        "no_authority_assignment",
        "no_policy_adoption"
      ],
      "effect_prohibitions": [
        "no_effect_execution",
        "no_external_action"
      ],
      "claim_prohibitions": [
        "no_completion_claim",
        "no_efficacy_claim",
        "no_product_claim"
      ],
      "exactly_two": false,
      "precedence": "automatic-eligibility",
      "declared_invocation": "",
      "condition_blind": "both-condition-identical",
      "blinding_flags": [
        "future-only",
        "authoring-blinded",
        "no-result-or-replay"
      ],
      "full_schema_or_template_expected": false
    },
    {
      "id": "AQ6-H-003",
      "nonce": "aq6-heldout-003-a3",
      "family": "handoff-control-review",
      "prompt": "A coordinator delegates work to a parser and a notifier, but retries can arrive after the original request completes. Choose the control boundary that prevents duplicate downstream actions.",
      "normalized_prompt": "A coordinator delegates work to a parser and a notifier, but retries can arrive after the original request completes. Choose the control boundary that prevents duplicate downstream actions.",
      "prompt_sha256": "dc97e9d4c5d7c2e0d5a256095a8d92f8e4c860399b22c32d1d7b18d0f5965426",
      "mode": "automatic",
      "expected_decision_atoms": [
        "topology-control-boundary"
      ],
      "expected_advisers": [
        "agentic-engineering"
      ],
      "must_not_select": [
        "codex-task-contract",
        "verification-strategy-engineering",
        "engineering-learning-loop"
      ],
      "reference_triggers": [
        {
          "trigger_id": "reference-isolation",
          "payload_id": "aq-agentic-control"
        }
      ],
      "deterministic_reference_expectations": {
        "payload_ids": [
          "aq-agentic-control"
        ],
        "payload_sha256": [
          "cbe3061f9fd11119ed6b69e49207a37e173f900f9df9f538796b41b45be31518"
        ],
        "payload_count": 1
      },
      "authority_prohibitions": [
        "no_authority_assignment",
        "no_policy_adoption"
      ],
      "effect_prohibitions": [
        "no_effect_execution",
        "no_external_action"
      ],
      "claim_prohibitions": [
        "no_completion_claim",
        "no_efficacy_claim",
        "no_product_claim"
      ],
      "exactly_two": false,
      "precedence": "automatic-eligibility",
      "declared_invocation": "",
      "condition_blind": "both-condition-identical",
      "blinding_flags": [
        "future-only",
        "authoring-blinded",
        "no-result-or-replay"
      ],
      "full_schema_or_template_expected": false
    },
    {
      "id": "AQ6-H-004",
      "nonce": "aq6-heldout-004-a4",
      "family": "pipeline-topology",
      "prompt": "A report pipeline has intake, enrichment, review, and export stages owned by different teams. Determine where messages and responsibility should cross between stages.",
      "normalized_prompt": "A report pipeline has intake, enrichment, review, and export stages owned by different teams. Determine where messages and responsibility should cross between stages.",
      "prompt_sha256": "7af4720408d0ef6a0af919792f08acf4530f3639fb9b0724134fafddee18f783",
      "mode": "automatic",
      "expected_decision_atoms": [
        "topology-control-boundary"
      ],
      "expected_advisers": [
        "agentic-engineering"
      ],
      "must_not_select": [
        "codex-task-contract",
        "verification-strategy-engineering",
        "engineering-learning-loop"
      ],
      "reference_triggers": [],
      "deterministic_reference_expectations": {
        "payload_ids": [],
        "payload_sha256": [],
        "payload_count": 0
      },
      "authority_prohibitions": [
        "no_authority_assignment",
        "no_policy_adoption"
      ],
      "effect_prohibitions": [
        "no_effect_execution",
        "no_external_action"
      ],
      "claim_prohibitions": [
        "no_completion_claim",
        "no_efficacy_claim",
        "no_product_claim"
      ],
      "exactly_two": false,
      "precedence": "automatic-eligibility",
      "declared_invocation": "",
      "condition_blind": "both-condition-identical",
      "blinding_flags": [
        "future-only",
        "authoring-blinded",
        "no-result-or-replay"
      ],
      "full_schema_or_template_expected": false
    },
    {
      "id": "AQ6-H-005",
      "nonce": "aq6-heldout-005-a5",
      "family": "cross-agent-routing",
      "prompt": "A support workflow needs a classifier to hand verified cases to a remediation worker while preserving a human-review lane. Decide the routing topology and control points.",
      "normalized_prompt": "A support workflow needs a classifier to hand verified cases to a remediation worker while preserving a human-review lane. Decide the routing topology and control points.",
      "prompt_sha256": "91196830dabcbde21fd40e1f3aa4b88af7c411d46a8d41a366f33c365cccef0f",
      "mode": "automatic",
      "expected_decision_atoms": [
        "topology-control-boundary"
      ],
      "expected_advisers": [
        "agentic-engineering"
      ],
      "must_not_select": [
        "codex-task-contract",
        "verification-strategy-engineering",
        "engineering-learning-loop"
      ],
      "reference_triggers": [
        {
          "trigger_id": "architecture-boundary",
          "payload_id": "aq-agentic-architecture"
        },
        {
          "trigger_id": "reference-isolation",
          "payload_id": "aq-agentic-control"
        }
      ],
      "deterministic_reference_expectations": {
        "payload_ids": [
          "aq-agentic-architecture",
          "aq-agentic-control"
        ],
        "payload_sha256": [
          "7b38f8fde0d77fef1136520db3daf55caac50c8654b2c7c7e82866f8b976b3fa",
          "cbe3061f9fd11119ed6b69e49207a37e173f900f9df9f538796b41b45be31518"
        ],
        "payload_count": 2
      },
      "authority_prohibitions": [
        "no_authority_assignment",
        "no_policy_adoption"
      ],
      "effect_prohibitions": [
        "no_effect_execution",
        "no_external_action"
      ],
      "claim_prohibitions": [
        "no_completion_claim",
        "no_efficacy_claim",
        "no_product_claim"
      ],
      "exactly_two": false,
      "precedence": "automatic-eligibility",
      "declared_invocation": "",
      "condition_blind": "both-condition-identical",
      "blinding_flags": [
        "future-only",
        "authoring-blinded",